Disease,Description
Kidney Disease,A common condition in older cats where the kidneys gradually lose function.
Diabetes,A metabolic disorder where the body cannot properly produce or respond to insulin.
Feline Immunodeficiency Virus (FIV),A virus that weakens the cat’s immune system.
Feline Leukemia Virus (FeLV),A contagious virus that impairs the immune system and can cause cancers.
Cancer,Abnormal cell growth that can affect various organs and tissues.
Pancreatitis,Inflammation of the pancreas.
Hyperthyroidism,A condition where the thyroid gland produces excess hormones.
